Students,answ1,answ2,answ3,answ4,answ5
John,Air and sunlight,Good explanation,Water,So they can make their own food,They'll die without it.
Sarah,Air and sunlight,Good job!,Water,So plants can make food,They'll wither away without water.
Alex,Air and sunlight,Great answer!,Water,So they can survive,They won't be able to grow without sunlight.
Emma,Air and sunlight,Well done!,Water,To produce their food,They'll perish without air and sunlight.
Michael,Air and sunlight,Excellent!,Water,So they can photosynthesize,"Without water, they won't be able to sustain life."
